The Angst of an Insurance Industry Outlook Report,By Kirstin Marr,Each year Valen Analytics produces an industry outlook report with our view on the market and what insurance companies should pay attention to in the coming year. As a technology and data analytics company we have a unique perspective to share as insurance faces unprecedented disruption and a real need for innovation.And so in the midst of a rapidly changing marketplace with pretty big stakes we publish a thought provoking report outlining what insurers need to focus on over the next 12 months to remain relevant and competitive. No pressure.When I started on our first outlook report in 2014 I pulled it together in just a few days. I didn’t really know if anyone would care what we had to say and wanted to hedge my bets in terms of the time and effort it takes to put something like that together. I was blown away by the hundreds of people who downloaded the report. Then we held a webinar to go through our recommendations more in-depth with over 150 attendees.Ok I thought we’ll up the stakes in 2015.And we did. We were pretty bold in our predictions that big technology companies were going to get much more serious about disrupting insurance; that the market share consolidation already seen in personal lines was coming to commercial lines more quickly than people thought; and that Millennials presented an entirely new paradigm that required insurers to be more transparent and responsive to their needs.Ever feel that twinge of uncertainty when sending an email with a strong response on something you feel passionate about? Well multiply that times 100 and you’ll get a sense of what I was feeling as we published the 2015 Outlook Report last fall.How did it work out? Beyond my wildest expectations.On technology disruption. Not only did Google Compare make its entry just a few months later our Summit keynote speaker Andrew Rose from Compare.com a Google partner actually made the breaking news announcement as the press release went live while he was on stage. Never could we have planned that in a million years! You could’ve heard a pin drop in the room. It was the worst kept secret in insurance of course but that didn’t matter when it was actually made public. You could almost see the wheels turning in our attendees’ heads…What does this mean for my business? On competitors and market share. This is the area where I most felt we could be out pretty far ahead of our skis. After all who really knows how long it will take to see more sophisticated competitors that leverage analytics to drive pricing and risk selection decisions start to dominate in the market? Well we were able to include in our 2016 Outlook Report that in workers’ compensation market share has shifted dramatically amongst the top 10. It’s a clear signal that this market is changing more quickly than what insurance is used to historically. Big sigh of relief!On Millennials. Investment in insurance tech startups is heating up big time. There’s some real momentum building as technology innovators look to serve the insurance customer in ways that are better faster and cheaper. That means more transparency during the buying process more on demand services and applications that make it easy to track your insurance policies and much more. 2016 should be an interesting year to watch how disruption will play out across the distribution supply chain.At Valen we love this stuff. We think this is an incredibly exciting time to be in insurance and serve carriers who are staying ahead of the curve. It will be bumpy at times but in the end the industry desperately needs to redefine what it means to serve the customer take more risks and be willing to test learn and adjust quickly. That’s the reality of modern business.Want to know more about our take on the market? Check out our 2016 Outlook Report and keep us honest as the year plays out. Did we get it right? Share your comments here or drop me a line @ Kirstin.Marr@valen.com.ABOUT THE AUTHOR:Kirstin Marr is the chief brand advocate for Valen Analytics paving the way for prospective clients to lead the innovation initiatives required to compete in today’s marketplace. She has a passion for building companies that invent leading-edge technologies to improve customers’ lives and solve the inefficiencies that exist in many traditional marketplaces. Kirstin also has a long-standing commitment to philanthropy and community leadership. She was most recently Board President for Colorado MESA a non-profit that serves underrepresented and economically disadvantaged students to graduate from college and successfully pursue careers in Science Technology Engineering and Mathematics (STEM). She also co-founded a non-profit to benefit the Teen Lounge at Children’s Hospital Colorado. ,0.21739077808156756,0.5138521018455229
Planning for a Predictive Analytics Implementation?,By Kirstin Marr,The economic crash of 2008 emphasized the importance of predictive modeling as a means to replace dwindling investment income with underwriting gains. However insurance companies today are looking at a more diverse and segmented market than pre-2008 which makes the “old way of doing things” no longer applicable. The insurance industry is increasing in complexity and with so many insurers successfully implementing predictive analytics greater precision in underwriting is becoming the “new normal.” In fact a recent A.M. Best study shows that P/C insurers are facing more aggressive pricing competition than any other insurance sector.But some carriers forget that implementation of predictive models isn’t one size fits all.  It requires more than just selecting the right model. Carriers need to follow very specific steps in the process to yield the best results from their investment. The most important first step is to make sure all relevant stakeholders understand the business goals and organizational commitment. The number one cause of failure in predictive modeling initiatives isn’t a technical or data problem but instead a lack of clarity on the business objective combined with a defect in an implementation plan (or lack thereof). Focus first on securing C-suite support as well as gaining buy-in from the underwriters who will be using the model.The next important step in any predictive analytics implementation is assessing your organization’s resources and capabilities. Regardless of whether the data analytics project will be internally or externally developed your assessment should be equally rigorous. Attention to the following areas will be crucial:Data Considerations: Do you have adequate data in-house to build a robust predictive model? If not which external data sources will help you fill in the gaps?Modeling Best Practices: Whether internal or external do you have a solid approach to data custody data partitioning model validation and choosing the right type of model for your specific application?IT Resources: Ensure that the scope is accurately defined and know when you will be able to implement the model. If time-to-market exceeds 18-24+ months you will lose competitive ground.Reporting: If it can be measured it can be managed. Reporting should include success metrics easily available to all stakeholders along with real-time insights so that your underwriters can make changes to improve risk selection and pricing decisions.Boiling this down it’s critical to align a data analytics initiative to a strategic business priority. Once you’ve done that it will be far easier to garner the time and attention required across the organization. Remember incorporating predictive analytics isn’t just about technology. Its success is heavily dependent on the people and process.Download the Punchlist to EnsureRock Solid Execution ,0.24387806637806647,0.4154917027417027
How to Gain Organizational Buy-In of Predictive Analytics,By Kirstin Marr,The economic crash of 2008 underscored the importance of predictive modeling as a means to replace dwindling investment income with underwriting gains. Even though the market currently show signs of strengthening insurance companies today are looking at a more diverse and segmented market than pre-2008 making the “old way of doing things” no longer applicable. The insurance industry is increasing in complexity and with so many insurers successfully implementing predictive analytics greater precision in underwriting is quickly becoming the “new normal.” In fact a recent A.M. Best study shows that P/C insurers are facing more aggressive pricing competition than any other insurance sector.Many of the insurers who have yet to implement a predictive model however aren’t sure what the first steps are to a successful implementation. One of the most crucial areas of focus should be gaining organizational buy-in. The most sophisticated and accurate model will be a wasted investment if the underwriters choose to deviate from the intended use of the model or worse ignore it completely. Data analytics can only be successful if developed and deployed in the right environment – so underwriters need to be on board with the plan of action as much as the C-suite.That being said given the choice between leading a large-scale change management initiative and getting a root canal many executives would rather pick up the phone to call the dentist. But it doesn’t have to be that way. Following a thoughtful and straightforward process that involves all stakeholders goes a long way. It’s best to prepare the following:A solid business casePlan for cultural adoptionClear straightforward processesA way to be transparent and share results (both good and bad)Training and tech supportWays to adjust – be open to feedback evaluate it objectively and make necessary changesGaining buy-in from the underwriting team requires that they understand why the model is being implemented what the desired outcomes are and what their role is in implementing it. But there are still some who rely solely on their own experience and knowledge that may feel threatened by a data-driven underwriting process. In fact nearly half of the attending carriers at the 2015 Valen Summit cited lack of underwriting adoption as one of the primary risks in a predictive analytics initiative.Insurers with the most success in predictive modeling implementation create a specific set of underwriting rules and effectively communicate how predictive analytics are another tool to enhance their performance rather than something that will replace them entirely. At the same time it is also important to monitor the implementation of underwriting guidelines ensuring that they are being followed appropriately.One company that exemplifies these best practices is Farm Bureau Financial Services which was honored with a Celent Model Insurer Award for their implementation of predictive analytics in underwriting. They ensured success by creating a process that was easy for everyone to understand the output and by implementing it in a consistent manner.While beginning a predictive analytics journey can be difficult and confusing at first glance following these best practices will increase your chances of getting it right on the first try and ensuring your business goals will be met. Remember incorporating predictive analytics isn’t just about technology – success is heavily dependent on the people and process.Get the Step-by-Step Guide to Gain Organizational Buy-In ,0.253417244855601,0.4568246061396748
The 1st Step in a Predictive Analytics Implementation,By Bret Shroyer FCAS,There’s little doubt about the proven value in using predictive analytics for risk selection and pricing in P/C insurance. In fact at this year’s Valen Analytics Summit insurance executives reported that many of them were already using predictive analytics for underwriting and the 56% that were not planned to start within a year. However many insurers haven’t spent enough energy planning exactly how to implement analytics to get the results they want. While insurers would like predictive analytics to be a one-size-fits-all improvement to their business it is a custom built tool where the degree of success is determined by the mutual understanding of the benefits and rules surrounding the predictive model and how it works within the specific organization.There are various steps that need attention along the implementation journey like gaining organizational buy-in and assessing your organization’s capabilities and resources. However the first step when considering predictive analytics is to secure senior level commitment.Information is a business enabler and any data analytics project must produce meaningful insights that will solve particular problems and achieve specific objectives. Once you define the problem to solve make sure that all the relevant stakeholders understand the business goals from the beginning and that you have secured executive commitment or sponsorship.Next the organization must agree up front upon a set of metrics which will measure the success of the implementation. Questions you will need to answer include:How will we prove that a predictive model will produce results? What is our proof of concept?What are the agreed upon metrics to measure success? These include loss ratio price competitiveness premium growth?What management reporting will you put in place? If it can be measured it can be managed.How do we know if a predictive model is giving us new insights vs. telling us what we already know?What is our risk appetite for this initiative? What are the assumptions and sensitivities in our model and how will those impact projected results?What is the plan to integrate the model within our existing workflow?Valen’s recent survey showed that loss ratio was the top issue for underwriting analytics. Whether it’s loss ratio pricing competitiveness premium growth or something else create a baseline so you can show before and after results with your analytics project. Remember to start small and build on early wins; don’t boil the ocean right out of the gate. Pick a portion of your policies or a test group of underwriters and run a limited pilot project. That’s the best way to get something started promptly prove you have the right process in place and make sure to scale as you see success.Finally consider the risk appetite for any particular initiative. What are the assumptions and sensitivities in your predictive model and how will those affect projected results? Don’t forget to think through how to integrate the model within your existing workflow.Get the Step-by-Step Guide forSecuring Executive Sponsorship ,0.22218778696051422,0.37868511959421053
Roadblocks to Insurance Innovation,By Kirstin Marr,Innovation in insurance is quickly moving from an “advantage” to a “necessity”. Consider this:Towers Watson recently reported that 87% of P&C insurers are seeing profitability with the use of predictive models. As a result many of their competitors are now being adversely selected (whether intentionally or not) along with an increasing disparity between carriers with a competitive edge and those without.Companies like Esurance and Progressive have long found success by building their brands by consistently evolving and changing with growing consumer demands. However now that Google has arrived on the scene the tech giant’s comparison site will put increased pressure on the rest of the insurance companies that have not been able to meet growing consumer demand. Its arrival will affect the entire industry—from the way they interact with customers to how they attract new customers and price risk more accurately.Millennials currently make up the largest generation in the U.S. Unfortunately for the industry they also happen to be the demographic most dissatisfied with insurance products and services. They strongly favor companies with easy-to-navigate websites and they don’t always base decisions on price alone as previous generations were prone to do.These topics have been at the forefront of the insurance industry signaling that the time to innovate is now. But are internal obstacles standing in the way of progress?Two recent polls of P/C executives with 312 responses indicate that there are internal conflicts plaguing insurers that may prevent successful implementation of innovative strategies within an organization.  The poll found that:77% believe underwriters & actuaries are at odds over price77% believe underwriters are resistant to adopting analyticsOne challenge here is that underwriters and actuaries approach their roles with opposing viewpoints: Actuaries try to contain risk while underwriters are assigned to take on more. What ends up happening is that the actuarial team sets rates only to see them “messed up” by underwriters bringing in new business. At the same time underwriters complain that it is “impossible” to write new business with rates that are too high to be competitive in a particular market.The frequently growing adoption of predictive analytics adds a separate challenge because underwriters don’t trust or understand new technology and are concerned that they will be replaced.That being said is there something happening on a fundamental level within many insurers that prevents them from fostering and executing innovation in a long-term sustainable way?We asked ourselves this same question so we hosted a webinar with Bret Shroyer FCAS Solutions Architect at Valen Analytics where we looked at:Details on what’s driving the underwriter-actuary conflictClear view inside today’s most successful insurersHistorical lessons of insurance innovation: credit score and cat modelingHow to address the underwriter resistance issue head on: you can solve thisIf you missed it you can still view the replay here: Failure to Innovate: What the Underwriter – Actuary Conflict Teaches Us. Enjoy!ABOUT THE AUTHOR:Kirstin Marr is the chief brand advocate for Valen Analytics paving the way for prospective clients to lead the innovation initiatives required to compete in today’s marketplace. She has a passion for building companies that invent leading-edge technologies to improve customers’ lives and solve the inefficiencies that exist in many traditional marketplaces. Kirstin also has a long-standing commitment to philanthropy and community leadership. She was most recently Board President for Colorado MESA a non-profit that serves underrepresented and economically disadvantaged students to graduate from college and successfully pursue careers in Science Technology Engineering and Mathematics (STEM). She also co-founded a non-profit to benefit the Teen Lounge at Children’s Hospital Colorado. ,0.16915893630179346,0.48996289424860845
Race for the Top 10%,By Bret Shroyer FCAS,After studying the portfolios of commercial lines insurers we discovered that 10% of their books contributed over 50% of expected profit across a range of companies and lines of business including work comp BOP and commercial auto. This is a prime example of the threat – as well as the advantage – of data analytics. The carrier who accurately identifies the best 10% of the market will be able to compete on and win this business while the carrier who can’t will lose out.This is why predictive analytics is rapidly emerging as a must-have tool in the insurance carrier’s arsenal. Predictive analytics can be deployed from the bottom up to look at everything from individual account pricing new business underwriting triage audit and inspection optimization claims management and incident-level fraud detection. Alternatively predictive analytics can also be deployed from the top down. Imagine if you could accurately predict your accident-year loss ratio every year by the end of June? Could you improve performance if you were armed with this kind of powerful insight?With embedded profit a forward-looking view of profitability at the policy level this type of proactive approach to your book of business is made possible. Embedded profit = collected premium – (predicted loss + predicted expense) and it offers a number of important advantages:It is credible at the policy level.It provides real-time feedback on profitability before policy inception (not 12-24 months later).It doesn’t depend on loss development or IBNR assumptions.It provides a new statistic which is very useful for other applications.These applications of predictive analytics while novel represent just an introduction to the possibilities. The shift to predictive analytics opens the door to a completely new class of metrics – real-time and forward-looking – that can fundamentally change the ways in which an insurance portfolio is managed. Embedded profit is just the tip of the iceberg.That being said implementing predictive analytics in an underwriting organization is a significant undertaking which many companies mistakenly equate success to selecting the right predictive model. However the model is only one part of a larger process. Whether you are developing a model in-house or using an external technology provider there are components common to every predictive analytics project that are necessary to ensure success. This punch list includes 3 step-by-step guides that will best prepare your organization to get started. ,0.2435073423308717,0.4655854766148884
Is Insurance an Easy Target for Criticism?,By Kirstin Marr,Transparency will come one way or anotherConsumer Reports recently published a scathing exposé of personal auto insurers which Bloomberg summarized with this headline: “Risky Borrowers May Be Treated Worse Than Drunks by Insurers”. The industry is coming under fire for using credit information to price personal auto insurance policies. But as Robert Hartwig president of the Insurance Information Institute noted in an interview for Bloomberg “The fact that insurance-based credit scores are an important part of setting rates is nothing new. It is strongly predictive of loss and that’s a net benefit to consumers.”Hartwig is making the important point that it’s an insurer’s job to use proven credible ways to identify which policyholders are more or less risky and charge accordingly. The entire notion of shared risk requires insurers to make these determinations with the best information available. Who among us would take on the liability of owning a car a home or starting a business if we didn’t have the insurance safety net? One bad car accident could wipe us out financially.I could go on defending insurance and listing the multitudes of other industries that use similar information to assess segment and target their customers. But that would be missing the point. In today’s information-at-your-fingertips world insurers have lagged behind in terms of modernizing their customer experience – which includes a healthy if uncomfortable dose of transparency.Gone are the days when a company controls the information a customer has about their products pricing and service record. The reality is that how you run your business price your products and treat your customers is publicly available 24/7. Granted the information consumers post online isn’t always accurate but insurance could do a much better job at building consumer relationships. According to an Ernst & Young study consumer trust for insurance companies is lower than other industries with 57% of consumers reporting dissatisfaction with the lack of interaction and proactive communication from insurers.If insurers aren’t having conversations and engaging their customers then the industry is letting its reputation be defined by others and studies show that your customers are more likely to share a bad experience than a good one. Investigations like the one from Consumer Reports are much more likely to target those industries that don’t engender consumer trust. There’s nothing fundamentally wrong about auto insurers having tested all types of information to find what is most predictive of loss. It’s not dissimilar to how online retailers collect our information as we surf the web to serve up relevant products and offers or apps that track our behavior at increasing rates. Insurers have an opportunity to step up efforts to create a real dialogue with consumers in order to start building trust. If they don’t they will continue to be an easy target for criticism and complaints.ABOUT THE AUTHOR:Kirstin Marr is the chief brand advocate for Valen Analytics paving the way for prospective clients to lead the innovation initiatives required to compete in today’s marketplace. She has a passion for building companies that invent leading-edge technologies to improve customers’ lives and solve the inefficiencies that exist in many traditional marketplaces. Kirstin also has a long-standing commitment to philanthropy and community leadership. She was most recently Board President for Colorado MESA a non-profit that serves underrepresented and economically disadvantaged students to graduate from college and successfully pursue careers in Science Technology Engineering and Mathematics (STEM). She also co-founded a non-profit to benefit the Teen Lounge at Children’s Hospital Colorado. ,0.1360071301247772,0.5211675579322638
