Pursuing a better rating? How predictive analytics can help.,By Kirstin Marr,It’s no secret that data and predictive analytics can be powerful tools. But they’re most powerful when leadership strategy and training come together in alignment on their value and application.This is especially crucial when an insurer is looking to diversify in order to receive a better independent agency rating. In 2016 Valen’s proprietary research found that nearly 47% of insurers found predictive analytics to be helpful when being evaluated by rating agencies like Fitch and AM Best.For FHM they needed to expand product offerings by entering new geographic territories. For 53 years FMH was a single monoline carrier writing work comp in Florida. When they decided to expand outside the type of business and location they knew well they found they needed help in more ways than one.We often discuss the delicate balance of being a data-driven organization while managing underwriter intuition and expertise. In FHM’s case they needed the tools to put emphasis on consistent underwriting performance risk selection and pricing. But they had to do it in a way that underwriters retained ownership of their decisions while putting consistent processes in place.Without the right data accessible combined with the proper training and support achieving positive results can be a challenge. FHM turned to Valen for help. How did FHM overcome these challenges? And what was the outcome?To find out read the full case study here. ABOUT THE AUTHOR:Kirstin Marr CMO of Valen Analytics has a passion for building companies that invent leading-edge technologies to improve customers’ lives and solve the inefficiencies that exist in traditional marketplaces. As the chief brand advocate for Valen Analytics she helps pave the way for Valen’s clients to lead the innovation initiatives required to compete in today’s marketplace. Before Valen she ran business-to-business marketing for internet technology pioneer and market leader ServiceMagic.com (now HomeAdvisor).Kirstin has a long-standing commitment to philanthropy and community leadership. Most recently Kirstin is leading the Insurance Careers Movement coalition a grassroots initiative of more than 850 insurance organizations raising awareness of what insurance has to offer young professionals. She has been involved in several non-profits focused on Science Technology Engineering and Mathematics (STEM) education among other non-profit causes. ,0.20992578849721705,0.4651785714285715
The Magic Bullet?,By Kirstin Marr,Is there really a magic bullet that targets the best business to write?The woes for commercial auto insurers are many. Inadequate rates and reserves over the past few years are piling up along with a host of additional factors. Less experienced commercial drivers increased accidents distracted driving a rise in medical and litigation costs and rising vehicle repair costs (due to better technology) all contribute to a troubled line of business.The result is an unsustainable combined ratio now at a 15 year high of 110.4% and according to Fitch it’s having a negative impact on profits for the entire P/C industry. This ripple effect is compounded by the fact that it’s also the fast-growing commercial line with 5.6% growth in direct liability premiums for 2016.Better risk selection and pricing approaches are the best places to start. If you can assess the risk and price it correctly for the exposure from the beginning you deal with the problem at the root cause. Many insurers turn to advanced data analytics to better inform decision making. Predictive models create equal segments or “bins” of premium or policy counts to rank order policies from the best performing (bin 1) to the worst (bin 10). It allows insurers to take a scientific approach to reviewing policies that often look similar on the surface and arm their underwriters with actionable insights to better align price to risk.One of the biggest myths surrounding this application is the “magic bullet.” Many insurers ask which vehicle class to throw out to achieve better numbers for example. As you can see in the graph below this isn’t how it works. Risk inherently exists in every class of business; there isn’t one type of business that is always lower or always higher risk. It comes down to more sophisticated ways of assessing individual policies to get the price right and book the business that fits your strategy for growing and managing your portfolio.Many insurers still have the wrong approach to understanding risk. Instead of a broad stroke it’s better to incorporate tools at the policy level that pinpoint the problem. The real magic bullet is to provide your underwriters with advanced analytics a clear strategy and the support of senior management to remedy the current state of commercial auto underwriting. ABOUT THE AUTHOR:Kirstin Marr CMO of Valen Analytics has a passion for building companies that invent leading-edge technologies to improve customers’ lives and solve the inefficiencies that exist in traditional marketplaces. As the chief brand advocate for Valen Analytics she helps pave the way for Valen’s clients to lead the innovation initiatives required to compete in today’s marketplace. Before Valen she ran business-to-business marketing for internet technology pioneer and market leader ServiceMagic.com (now HomeAdvisor).Kirstin has a long-standing commitment to philanthropy and community leadership. Most recently Kirstin is leading the Insurance Careers Movement coalition a grassroots initiative of more than 850 insurance organizations raising awareness of what insurance has to offer young professionals. She has been involved in several non-profits focused on Science Technology Engineering and Mathematics (STEM) education among other non-profit causes. ,0.19048133450911228,0.468557466196355
Two Critical Concerns for Work Comp Insurers,By Kirstin Marr,Workers’ compensation has enjoyed overall profitability for the past few years. When you consider how technology is reshaping the workplace and the impact of rising claims costs it’s clear change is on the horizon. What are the near-term implications for insurers? Two key areas of focus are growth and claims handling.Grow or dieWork comp is the leader in commercial lines in terms of market sophistication and the increasing use of analytics to compete on pricing. Unless your company is looking to be acquired the race is on for grabbing market share.  As illustrated in the chart above savvy market segmentation and pricing strategies are allowing the top players to secure market share. Companies who want a seat at the table must be willing to adopt the necessary tactics in order to achieve substantial growth.Additionally for multi-line property and casualty carriers expanded product offerings will be essential to reach new customers. For monoline work comp carriers writing additional class codes and expanding geographic territories will be an important way to expand business.Manage SeverityAlthough work comp claims overall are down severity is up. Since 1995 indemnity has increased 138% and lost-time claims severity has increased 214%. In comparison to previous years NCCI states the average medical lost-time claim severity grew 5% from 2015 to 2016 an additional 3.8% in 2016. And while the change was negligible for 2017 3.3% is already projected for 2018.When embraced early on predictive models can help stem severity. For example analytics can determine which claims could skyrocket ultimate close dates and final payments amounts. They can also pinpoint when to close a claim quickly and when it’s appropriate to involve a more skilled adjuster or nurse case manager.Get the team on boardTelling a simple and compelling story to your team about the challenges your business is facing and the strategies you are employing to address them goes a long way to getting buy in. For other tips on how to best implement analytics download the Organizational Readiness for Predictive Analytics checklist. ABOUT THE AUTHOR:Kirstin Marr CMO of Valen Analytics has a passion for building companies that invent leading-edge technologies to improve customers’ lives and solve the inefficiencies that exist in traditional marketplaces. As the chief brand advocate for Valen Analytics she helps pave the way for Valen’s clients to lead the innovation initiatives required to compete in today’s marketplace. Before Valen she ran business-to-business marketing for internet technology pioneer and market leader ServiceMagic.com (now HomeAdvisor).Kirstin has a long-standing commitment to philanthropy and community leadership. Most recently Kirstin is leading the Insurance Careers Movement coalition a grassroots initiative of more than 850 insurance organizations raising awareness of what insurance has to offer young professionals. She has been involved in several non-profits focused on Science Technology Engineering and Mathematics (STEM) education among other non-profit causes. ,0.13839678839678837,0.43847633847633843
The Power of the Underwriter,By Kirstin Marr,Due to the rise of automation the role of the underwriter is changing. Even though technology is an enabler the expertise of an underwriter will always be an essential part of the equation.To validate this Valen conducted a study of a regional P/C insurer to identify the power of underwriting expertise. The study compared the usage of a model against the underwriters’ own predictions as well as a hybrid approach.In a three-part test comparison the results yielded the following:Underwriter (green line): This underwriting organization did in fact separate risks from best quality to worst quality. The best risks had a loss ratio about 20% better than average. The worst were 30% to 50% worse than average.Predictive Model (red line): This improved the overall differential between “best and worst” – the best risks are 50% better than average and the worst are about 75% worse than average.Hybrid Model (blue line): The average of the underwriter’s prediction and the model’s prediction which is represented by the blue line on the graph. It has by far the most lift which is 75% better than average all the way up to 120% worse than average.Time and time again the expertise of an underwriter supported by technology proves to be a winning combination.It is important to note resistance to predictive analytics in an organization is relevant. Out of 2000 participants a recent Celent study found nearly 47% of their organizations use of advanced data is infrequent at best to none at worst. Therefore the first hurdle is getting leadership to adopt a data-driven approach towards profitability. Then together with proper support implementation and analytics training the value of the underwriter can never be eclipsed. ABOUT THE AUTHOR:Kirstin Marr CMO of Valen Analytics has a passion for building companies that invent leading-edge technologies to improve customers’ lives and solve the inefficiencies that exist in traditional marketplaces. As the chief brand advocate for Valen Analytics she helps pave the way for Valen’s clients to lead the innovation initiatives required to compete in today’s marketplace. Before Valen she ran business-to-business marketing for internet technology pioneer and market leader ServiceMagic.com (now HomeAdvisor).Kirstin has a long-standing commitment to philanthropy and community leadership. Most recently Kirstin is leading the Insurance Careers Movement coalition a grassroots initiative of more than 850 insurance organizations raising awareness of what insurance has to offer young professionals. She has been involved in several non-profits focused on Science Technology Engineering and Mathematics (STEM) education among other non-profit causes. ,0.069,0.4696666666666667
The 5 Must Do’s of Data Collection,By Kirstin Marr,If you were to build a house it would take more than just supplies. It requires a sturdy blueprint a capable team and the right resources to bring it to life.The same process is true for insurers developing an advanced data and predictive analytics solution. It starts with a plan followed by quality data a capable team of both architects and data scientists and a handful of other factors to successfully build and incorporate the practice into the business.While this may seem like a massive undertaking it can be tackled in smaller manageable steps. Here we will address the necessary must do’s regarding data whether an insurer is building buying or creating a hybrid data solution.The must do’s of data collectionHave the right team in placeIn an ideal structure a data engineering team will collect cleanse and maintain an efficient database that can be leveraged by the data scientists. A data architect is best equipped to lead the data engineering team to design high-level reports for executives append external data sources update databases and work closely with the data scientists to help build predictive models.Work in an ecosystemAny data project should be part of a bigger ecosystem and the more integrated the better. The team must consider everything from the sources of data to the integration points and even training of the end users. When all the parts play together you have a cohesive solution that can deliver quality insights. The most common reason for failure is when the implementation hasn’t been thought through. Therefore when it’s time to implement the technical staff needs to collaborate with the business to make sure a plan is in place.Conduct a data inventoryIt’s important to take a technical inventory of the data you are using. This provides an initial benchmark of data and relationships and what you’re working with. Things like summary statistics or data sets with no variability or poor populations are useful to know up front. Not only is this helpful initially but also for on-going monitoring and performance evaluation of the solution.Data cleansingNow it’s time to evaluate if all of your data is relevant and meets expectations. This process will help you identify where the data needs to cleansed and what you could potentially remove from the model data set. You can use different types of visual diagrams to illustrate this process including heat maps trends aggregation models and more.Data GovernanceAs you go through the process of inventory and cleansing you will ultimately find things that cause you to reexamine the data. Data governance provides visibility to the changes that occur to data profiles. Keeping track of data versions revision history and security is crucial in understanding the evolution of the data and how it influences your modeling efforts. When data governance is lacking there are significant risks including a lack of ownership and transparency to name a few.These components make up the blueprint that becomes your overall approach to an analytics-based solution. Step by step we walk through how to begin building each of these pieces in our recorded webinar The Complete Guide for Implementing Predictive Analytics for Data Scientists and IT Professionals.Watch the replay ,0.1810657596371882,0.5198885109599396
Commercial Auto’s Wild Ride,By Kirstin Marr,The speed the climb the drop and the turns…rollercoasters are an exhilarating thrill! But if the rollercoaster is commercial auto some insurers may be happy to get off the ride.It’s no secret the commercial auto industry is feeling pain. Much of it can be attributed to a soft market high claim payouts and inadequate ISO rates. A recent Carrier Management article re-emphasized this notion citing advanced technologies distracted driving and poorly trained drivers resulting in unfavorable claims results. Furthermore despite rate increases 2016 was the worst year for underwriting performance since 2001 with combined ratios growing 1.6% to 110.4% from the previous year.While the uncertainty of the situation may seem nauseating about 20% of commercial auto carriers are running a profit. What do they know that others don’t and what are they doing differently? More importantly will it remain at 20%? Or 18 months from now will we see the number of profitable insurers grow?Several indicators exist on how this will play out take personal auto for example. In the past six years profitable personal auto insurers can attribute their success to the adoption of data and analytics. To beat adverse selection they have effectively leveraged data to select price business and manage claims. This example has also played out effectively in work comp with the top carriers vying for market share over the last 5 years.Independent rating agencies like AM Best and Fitch agree. With negative outlooks projected for all commercial lines insurers that fail to adopt the advanced analytics and enhanced data to make competitive decisions will be unable to compete. It boils down to those that have incorporated analytics and those who have not.It’s up to insurers to decide when to face uncertainty head-on and make investments in the future. After all a ride on a Merry-Go-Round is much less stressful than on a rollercoaster.Learn how one commercial auto insurer fought adverse selection and improved their loss ratio by 29 points in our latest case study.  ABOUT THE AUTHOR:Kirstin Marr CMO of Valen Analytics has a passion for building companies that invent leading-edge technologies to improve customers’ lives and solve the inefficiencies that exist in traditional marketplaces. As the chief brand advocate for Valen Analytics she helps pave the way for Valen’s clients to lead the innovation initiatives required to compete in today’s marketplace. Before Valen she ran business-to-business marketing for internet technology pioneer and market leader ServiceMagic.com (now HomeAdvisor).Kirstin has a long-standing commitment to philanthropy and community leadership. Most recently Kirstin is leading the Insurance Careers Movement coalition a grassroots initiative of more than 850 insurance organizations raising awareness of what insurance has to offer young professionals. She has been involved in several non-profits focused on Science Technology Engineering and Mathematics (STEM) education among other non-profit causes.  ,0.11525252525252526,0.39099747474747476
Meet Bob Claims Superhero,By Kirstin Marr,Bob is a straight up superhero. It’s not such a big leap to think of Bob this way given claims adjusters help make people whole every day after some unfortunate incident. But how did Bob reach superhero status? His many years of experience are incredibly valuable to his customers. With his uncanny knack for knowing when to ask probing questions and when to lend a sympathetic ear his customers often remark how Bob was ‘really there’ for them in their time of need.Still Bob wasn’t one to rest on his laurels. He developed an immense superpower that allowed him to see into the future and prevent accidents before they ever happened. World peace was a world with no accidents no turmoil!A bit farfetched? Truth be told that was just a cool dream Bob had one night. What he actually found was something much more useful. In the real world of complex work comp claims Bob realized the value in leveraging the latest tools to understand early on the trajectory of claims and their potential to skyrocket.Claims adjusters are busy and focused on properly handling claims in a swift and efficient manner. And they have the added pressure of knowing that the outcome of their work directly affects an insurer’s bottom line. Leveraging predictive models can help their process and pinpoint crucial information necessary to effectively triage a claim. Things like knowing more definitively the likelihood of a claim spiraling out of control (jumpers) the need for a nurse case manager ultimate payment predictors and so on.A LexisNexis study pointed to the value of advanced analytics. When implemented early on insurers experienced the following impact to ROI:15-25% lower severity payments25-29% lower attorney involvement5-15% shorter cycle timesAdvanced data analytic approaches to managing claims is growing especially to account for a wave of experienced adjusters retiring from the industry. Valen is creating a conversation around claims and the arsenal that creates claims superheroes like Bob in your organization. We’d be happy to hear from you. Request a conversation.ABOUT THE AUTHOR:Kirstin Marr CMO of Valen Analytics has a passion for building companies that invent leading-edge technologies to improve customers’ lives and solve the inefficiencies that exist in traditional marketplaces. As the chief brand advocate for Valen Analytics she helps pave the way for Valen’s clients to lead the innovation initiatives required to compete in today’s marketplace. Before Valen she ran business-to-business marketing for internet technology pioneer and market leader ServiceMagic.com (now HomeAdvisor).Kirstin has a long-standing commitment to philanthropy and community leadership. Most recently Kirstin is leading the Insurance Careers Movement coalition a grassroots initiative of more than 850 insurance organizations raising awareness of what insurance has to offer young professionals. She has been involved in several non-profits focused on Science Technology Engineering and Mathematics (STEM) education among other non-profit causes.  ,0.2119318181818182,0.5420454545454546
Is the Market Leaving You Behind? Valen’s ROI Study Showcases Insurers Leading Work Comp,By Kirstin Marr,Why now?Why is now the time for a more sophisticated approach to pricing and risk selection? Well a growing number of insurers are improving their performance and grabbing market share at rates that leave the competition in the dust.How long until it impacts you?In our 2017 Outlook Report we highlighted the need to shift the traditional insurance mindset. Today the focus has become the policyholder as the primary customer (not the agent/broker) and the need to adopt the same methods tech giants use to win customer loyalty. The third principle is understanding the best mechanism to leverage the fundamental building blocks of data and analytics.What Valen’s ROI study really highlights is what occurs when insurers become experts at how to incorporate analytics into their overall business strategy and decision-making. The exercise quantified 16 workers’ compensation insurers writing $1.76 billion in premium over a five- year period.For the second consecutive year of running the study the numbers speak loud and clear:53% higher premiums (2.9X industry average)25% improvement in loss ratios (1.9x industry average)What do they all have in common?  They’ve partnered with Valen to help execute a data- first approach to analytics as part of an overall business strategy with clearly defined goals. When a model is properly calibrated to achieve measurable outcomes and is accompanied by a thoughtful approach to integration and implementation it empowers underwriter performance. Being a data-driven company is a best-practice for better risk selection pricing and profitability. And it’s a winning formula that helps customers win too.For deeper analysis check out the infographic and read our case studies. ABOUT THE AUTHOR:Kirstin Marr CMO of Valen Analytics has a passion for building companies that invent leading-edge technologies to improve customers’ lives and solve the inefficiencies that exist in traditional marketplaces. As the chief brand advocate for Valen Analytics she helps pave the way for Valen’s clients to lead the innovation initiatives required to compete in today’s marketplace. Before Valen she ran business-to-business marketing for internet technology pioneer and market leader ServiceMagic.com (now HomeAdvisor).Kirstin has a long-standing commitment to philanthropy and community leadership. Most recently Kirstin is leading the Insurance Careers Movement coalition a grassroots initiative of more than 850 insurance organizations raising awareness of what insurance has to offer young professionals. She has been involved in several non-profits focused on Science Technology Engineering and Mathematics (STEM) education among other non-profit causes.  ,0.2037878787878788,0.39090909090909093
